Ethel,../graphics/ethelpfp.png,"Hi, can you help me to go to the next location, please?"
Altamira,../graphics/paintingpfp2_nobg.png,Let me think about it first. Umm... okay
Ethel,../graphics/ethelpfp.png,Really? Thank you so much!
Altamira,../graphics/paintingpfp2_nobg.png,"Be careful with the next two paintings, but I don’t really worry about them"
Altamira,../graphics/paintingpfp2_nobg.png,since you’re really polite and I feel like they would let you pass to the next locations.
Altamira,../graphics/paintingpfp2_nobg.png,Good luck my friend!
Ethel,../graphics/ethelpfp.png,Thank you very much! Goodbye!
