Ethel,../graphics/ethelpfp.png,Hey you! Can you help me go to the next location?,
Altamira,../graphics/paintingpfp2_nobg.png,Oh wow! How did you reach the level while having that kind of attitude? ,
Altamira,../graphics/paintingpfp2_nobg.png,It seems that the first painting didn’t do his job well. ,
Altamira,../graphics/paintingpfp2_nobg.png,"Oh well, let me teach you a lesson.",
Ethel,../graphics/ethelpfp.png,The first one already did that to me and It was pretty easy,
Altamira,../graphics/paintingpfp2_nobg.png,Let’s see,puzzle3
